duration,date,subjectcode,rule.break,why,consequences,manager.response,you,company,other,agree,industry,job.description,manager,comments1,comments2
155,7/13/21 17:29,R_2fCbEgFDXiF7v64,I accepted a holiday gift from a customer.,Because I felt weird declining it.,No consequences it was never discovered by management,It was not known to my manager.,2,-2,-2,-2,pharmacy,quality assurance and regulatory affairs.  managing a small group of techs,1,no,no
110,7/13/21 17:38,R_eu0suZdongC6WQ1,I went to the bathroom even though I was not supposed to stop working.,I had to use the bathroom.,Nothing.,They never found out.,1,1,-1,-1,Retail,Organizing shipment boxes into other containers.,0,No,
374,7/13/21 18:07,R_p6G2j0GTIPUhE2Z,I once started shutting down the store before it was closing time. I did this because there were still many customers in the store and I wanted to go home on time. I started to count the registers and lock up the money in the safe thirty minutes before closing. I started shuttering the windows and turning off the extra lights and the store was pretty much closed with ten minutes to spare.,I did this because there were still many customers in the store and I wanted to go home on time. I had been yelled at in the past about keeping customers and employees in the store too late. I also wanted to please my new manager.,I didn't receive any immediate consequences. I found out a month later that they did an internal investigation on me. They decided that I was no longer to be a manager due to this violation and eventually they fired me.,They thought that it was okay at that time. I found later that my manager changed their opinion once our district manager told him that this was a major violation. My manager then started to yell at me for breaking company policy and they participated in firing me. ,-2,2,2,2,I was in that job two years ago. I was in the telecommunications industry.,I had to open and close the store. I had to onboard all of my subordinates and set their schedule and duties on a daily basis.,1,I didn't find anything to be confusing or unclear.,Thank you for an informative survey.
389,7/13/21 19:20,R_3fs2LhQTeZwib99,"I broke a rule one time in taking an extra break. It was extremely busy and I had been working many hours of overtime. I was staying late and I needed to get away from the stress for a few minutes, although I wasn't technically allowed to have the break, due to the hours I was working and had already had the 'scheduled' breaks.","I was very stressed and overwhelmed. I felt I needed some fresh air and a few moments to compose myself, as I felt on the verge of tears.",None,My manager actually had come outside to take a break themselves. They saw me and asked me if I needed to take a break. I answered that I did. They laughed and stated they could understand why I would need a break. ,2,-2,-2,2,manufacturing,"I was a PC Clerk and team leader. My role was to enter and verify data, create and manage reports, track orders and general leadership of the PC department for that area.",1,no,
413,7/13/21 20:02,R_2ZWXqSFB3v7MLVv,i went to late one day on purpose because i did not meet this guy who was there to fix the system,i just do not like the guy and i did not want to pretend that i like him,"nothing much my boss asked me why i was late and i told him i got stuck in the traffic, i am never late and very responsible so my boss did not question me.",He was fine because i am very punctual and responsible so he did not question me about it.,1,-2,-2,1,I was working in Finance and Insurance company where we help our clients assess the Profit and loss and also provide insurance for the businesses. ,"I am the Finance Manager, i handle all major accounts.",1,no,no
706,7/13/21 20:39,R_1guV4Lr48bPgiee,"I once had to get a job at work done quickly in an emergency. There were protocols in place for doing the procedure, but I had to leave the paperwork until later and get the job done fast. I went back and fixed the paperwork mess after the crisis was over.",There was an emergency; the product I was processing was needed as fast as possible.,I had to write up the incident in an incident report and I had to fill out all the paperwork that was supposed to be filled out when processing the product after I was done processing it.,"She was fine with it; rarely emergency situations come up and that's what the incident reports are for. If I hadn't kept up with the paperwork or done the procedure wrong or not filled out the incident report I would have been in trouble, though.",-2,-1,-1,2,Hospital laborartory,"I was working in the blood bank, crossmatching blood types and releasing blood products (cells, plasma, platelets)",0,no,
1577,7/13/21 22:20,R_1gtCoEeRxExsspM,I was told not to use a certain material when putting a product together. ,It seemed like it was going to be ideal for the particular project I was working on. ,Another person saw me and told on me. ,The manager spoke to me about it and felt that I did not respect their wishes. ,-2,0,0,-1,Art/Design - Designer/Client Services,"It was an art/design job. Working with clients, designing the products, working on finished products for the clients. ",0,No.,No comments. 
1543,7/13/21 22:58,R_2CfHbAKvDIWiAC2,I once picked up a child in order to move them. We are not supposed to touch children.,I did it because it was the easiest way to accomplish getting the child to where I needed them.,There were no consequences.,They did nothing to me. ,1,0,-2,-1,Education,I am to ensure the children have safe and educational experience. ,0,n/a,
227,7/14/21 2:35,R_O9y8RGR34L3Qpod,"Since my job consisted of working with food, sometimes if a manager or someone equivalent wasn't watching I would play with the food. ","During non-busy hours, I got really bored and felt like there was nothing for me to do. To me, being idle is worse than being busy. ","I was not caught, so there were no consequences. ","If I were caught, my manager would likely get mad and scold me to not do it again, but it would likely only serve as a warning. ",1,-1,-2,-2,Food,"I work at a semi-self-serve food bar. When people needed a food item that was not self-serve, they would ask for it and I would handle the food. ",0,N/A,N/A
404,7/14/21 5:31,R_3Rt43gbawQiS4NQ,"I gave a free value meal to a homeless woman and her little boy using my own daily free meal, and paying for the rest from my pocket.","They where hungry, and having a hard time and I felt sorry for them. I wanted to help in even a small way.","Nothing really, other than I was short my employee meal and a few bucks from my own pocket.","He smiled and told me I have a good heart. You could also say he ""looked the other way"" because he could have wrote me up, but he didn't.",-2,-1,2,1,fast food,"Typical normal McDonald's team leader. (Not manager, one step lower)",1,no,nothing I can really think of.
431,7/14/21 13:38,R_3eqxy6yIpziL2UY,"I was working as an events coordinator at the non-profit's annual conference. The new Ex Dir. thought that the bookstore should be run one way and from personal experience, I knew it would not work. I did not have it run the way she wanted. Everything worked out, but when we got back to the office we had a big fight and I ended up quitting.",I knew her way would not be good for the organization.,A fight and I quit,She reamed me out in front of the other staff.,-2,0,2,-2,non-profit entertainment,Plan and execute the annual conference for members of the organization,1,no,"Yes, the supervisor lasted a few months after I quit. The organization decided to ""wish her well in her new endeavors"" and parted ways with her"