duration,date,subjectcode,rule.break,why,consequences,manager.response,you,company,other,agree,industry,job.description,manager,comments1,comments2
126,7/13/21 12:43,R_2zYENWlO4pFDczf,I intentional broke a company rule when I went home early from work last week. I wanted to get a head start on the weekend so I went home early.,I wanted to get a head start on the weekend.,"Nothing, I wasn't reprimanded.",no,1,-2,-2,-1,publishing,I write and edit.,0,no,no
201,7/13/21 12:44,R_1fa4RyZCdzG4OpT,I accessed a co worker's work mail account to help him do something related to his personal life,I owed him a favor and it was no big deal,I got a stern talking to and that was pretty much it since I was a good employee,"He told me the usual. Gave me a lecture by the books, but I don't think he really cared. So I basically got a short minute long lecture then I was on my way",-2,-2,2,-2,social media management,Manage social media for companies and garner a larger audience for the company,0,No,
74,7/13/21 12:46,R_3Kp5VdBYezuhVt2,i chose to not go to a company gathering,i do not like the people I work with,people thought I was weird,did not respond,1,-1,-1,-1,purchasing,Making purchase orders,0,,
175,7/13/21 12:49,R_2bOSO2oBygABzR3,"A customer was facing an unnecessary charge and while I didn't have the authority to issue a refund, I went ahead and did issue that refund.","It was the right thing to do for the customer, for the company, for my morals and for society.","There were no consequences, yet, maybe nobody will find out",I didn't tell my manager and I'm hoping they don't find out. ,0,-1,-2,0,Its in the gaming industry,I am a customer support representative for a video game company,0,No issues,
145,7/13/21 12:52,R_XzID1AFjMxRu0rD,"I work with animals and I'm supposed to clean up their shit twice a day but sometimes it doesn't seem necessary so I skip it,",The yard was mostly clean and I had already had a long work day,There were none. It was over a period of time where i'm the only worker on site for a month or two and I self manage.,They didn't know,1,-2,-2,1,I work with a team of dogs,"I feed them, look after their health, train them and play with them, get them exercise, clean up the yard and look over the property of the team owner",0,no,
231,7/13/21 12:53,R_1eCV8Qo9FbRnf3b,I took a personal during work hours.,I was trying to arrange some house work and I didn't think it would take very long or be that big of deal as long as I was able to get all my work done for the day.,I was just told that I shouldn't be doing it on company time., My manager said that I should take those calls at lunch or take a bathroom break and do it then.,1,-1,-2,0,I was a web developer,I was tasked with designing and building websites for clients.,0,No,
510,7/13/21 12:53,R_YPOA0NFD7QxaFON,"At my old job, I sometimes took more than an hour for lunch and would take several short breaks during the day. I was only allowed to take an hour for lunch, but sometimes would take over an hour and sometimes take 15 minute breaks at other times, because I was overworked and was involved in a toxic work environment.",I took these breaks because I was overworked and the amount of work was not feasible for one person and felt like I needed extra breaks. I also was looking to get out of the job because of the toxic work environment that developed over the last few years that I was there. I didn't really care that much of being reprimanded if something was said to me.,"There were really no consequences but sometimes my supervisor would say something and I just responded that I lost track of time. I was never written up or anything, but sometimes I had things put in my evaluation that I had developed a 'bad attitude'.","She would sometimes say something if she noticed that I was taking longer than normal for lunch break, but was never written up. She did, however, put some things in my evaluation, that I had developed a 'bad attitude'. She took longer than allowed breaks also, so I didn't really respond to any response that I got.",1,-2,-2,-2,Education,"I was a data analyst and analyzed data that we collected through surveys, etc.",0,nope,
325,7/13/21 12:53,R_1dzYxugGcYILdUa,I was told not to bring in another tech to look at a piece of necessary machinary that needed fixing that the other tech they kept bringing in couldn't fix. When my manager was out sick I called the other tech behind his back.,Because it was a plate maker for the press was imagining crooked causing all kinds of problems in the pressroom as well as quality control. I knew another tech from a previous job that worked for the same as the other tech. I was sure he could solve the problem.,The machine got fixed and NOBODY said anything.,My manager didn't say anything because he didn't want to admit I knew more than he did.,2,2,2,-2,I was a prepress manager for a commercial printing company.,To generate printing plates of the presses in the press room.,0,No.,No.
475,7/13/21 12:59,R_7OQOd6dvCX71eBX,You should take disciplinary action against an employee who violates company policies right away. You should do this because this is when what they did is most apt to be at the forefront of their mind. You also send a message to other would-be policy breakers that you mean business by doing so.,"Under the Employment at Will Doctrine, employers may fire employees for just about any reason, including company policy violation. As a result, an employee breach of the implied contract in the form of policy violation, might constitute good cause for the employer to fire the employee. ","It does not matter if you broke the item intentionally or negligently or ""with gross negligence"". An employer can seek to be reimbursed, ask you to pay for the item, fire you or otherwise discipline you, but employers who help themselves to employee wages are thieves.","In some situations, an employer is required to follow their own policies and apply them consistently, or be subject to legal liability. For example, the failure to follow established policies is illegal when: ... Or the language of an employee handbook or other policy creates a contract.",2,2,2,2,human resources,marketing,1,nothing,
949,7/13/21 13:02,R_24HMExfYXgUdOwK,A time in which I intentionally broke a company rule is when I left a catered event I was scheduled to work at to go assist another team with the event they were catering.,"Our event was easier than expected, and the amount of staff we had at it was unnecessary to handle the amount of clientele we had.  We had served everything and were basically sitting around until it was time to start breaking down everything.  Instead of staying to help my team breakdown everything, and haul it back to our shop where we'd do any necessary cleaning, I informed them that i was going to leave it to them as a colleague informed me that they were getting hammered at another event.  I felt at that moment, I would be of better use helping up their team and that my team could afford to lose me for the evening.  The other team was overwhelmed and the event they were on was far busier than expected, so I felt it would be better for me to be there, helping them get through their event, than sit around waiting for my event to end.","The consequences for my team were that it would take them a bit extra time to break down and they would likely be at our shop longer cleaning up, but on the flip side of it, it also meant that I'd be able to help the team who was overwhelmed, get through their event more smoothly, get them packed up quicker, and get their cleaning at the shop done a bit quicker so they wouldn't be stuck at work all night.  My team still would get out of a work at a reasonable hour without me assisting them, making me feel as if they'd be ok with me jumping ship to help another team out who was very much desperate for help.","My manager wished I had informed him of my decision to go help another team out, leaving the team I was on in doing so, but when I explained the situation to them as a whole, they thought I did the right thing and thanked me for doing so, as they had a lot of catered events scheduled for the night and knew some of them might be understaffed.  They just told me in the future to call them before making such decisions in the future so they can figure out if I'm best to go help another team or stay where I'm at.",2,2,2,1,Hospitality,"I work at an events supervisor for a catering company on the culinary side.  I manage some of our kitchen staff, manage serving staff at some events, and also am a preparations cook when we're preparing food for our events.",1,"No, the instructions were very clear and easy to follow",
215,7/13/21 13:02,R_24kLmMokgzb32Dd,I would use the bathroom during wrap-up times when I worked at a call center.,"I didn't feel the break times were sufficient to use the bathroom. Also, I usually took notes while I was on the phone with the customer so I didn't have to worry about wrapping up afterward.","Nothing, I was never reprimanded for doing this.","My manager did not know, I still performed the highest in my group.",2,-1,-1,-2,customer service,"I worked at a student loan servicing company. I would be on the phone most of the day, and oftentimes we were too busy to get our break time.",0,no,
1013,7/13/21 13:10,R_1nPIfGKBu5bAS5s,There was a time i had a fight with one of our female staff for abusing me and sending negatives words to my family and sending abusive word to me and that led to a hitted fight which led to 2 week suspension at my place of work.,she insulted my and passed abusive words to my family ,i went on suspension for 2 weeks with the other person,The manager responded so bad and made us a deterrent to other staff and after the suspension preached love for both parties.,-2,-2,-2,-2,retail and sales .,The responsibilities were attending to customers and also distributing finished products to other outlets. the work was based on shifting and we are assign base on weekly shifts.,0,none,no
214,7/13/21 13:10,R_1OrZdrHaSOZE9UX,One time when I was younger I was working out of the back room of a department store. As we were pressed for time I would use climb up onto the shelves to scan and pull items that we needed rather than utilize a ladder.,I was pressed for time and thought I could get things done faster doing it that way.,"There were no consequences to my knowledge as I never did it when my superiors were around. I was smart enough to make sure it was just us before doing so, otherwise I did it the way the company preferred.","I never got a lecture or a warning doing it, my manager never caught me I suppose or if he knew he didn't care or at least he didn't tell me that he knew.",1,1,-1,-1,Retail,The job was basically pulling inventory off the shelves and loading it up and then sending it out onto the floor so that they could stock it. After that they'd send any extra inventory back and we'd put it back onto the shelves.,0,There was nothing confusing or unclear.,
138,7/13/21 13:11,R_1LYD11cMgNiUy4w,I took a day off that I wasn't supposed to.,I had an important appointment that I couldn't miss.,"No real major consequences, just a passive-aggressive response.",They were mildly irritated but got over it quickly.,2,-2,-2,-1,non-profit,I was responsible for office work.,0,No,Thanks!
154,7/13/21 13:14,R_31Gwhz4kP4byQcv,I did not call tech support when I said that I would.,I didn't want to deal with tech support and thought I could solve the issue on my own.,I solved the problem myself so there were no consequences.,My manager did not know. The problem was solved and that took care of any issues.,1,1,-1,-1,Executive Search,"I oversee a team of administrative professionals. I maintain our applicant tracking system and our website, along with overseeing the creation of digital brochures.",1,No,
246,7/13/21 13:22,R_2fHXbYxqUB00VRx,I called in with a dr appt but I actually went fishing,Just felt like getting out a few and sick time is automatic if under 3 days.,NONE,is not aware of what I really did,2,-2,-2,1,human resources at a hospital,I do reports and quality review HR actions on current employees,0,no,
93,7/13/21 13:23,R_2Pu5kM9rOszE5Kw,I broke a rule when I went to the bathroom after clocking in. I was suppose to go before per policy.,I was runing late. ,Nothing,They didn't find out!,1,-2,-1,-1,I was working in healthcare as a pharmacist.,I verify orders and check prescription medications. ,1,No,"It wasn't a big one, but I don't break many rules at work. This was against policy though."
497,7/13/21 13:25,R_VX3ldw4J9bDISOd,"On this particular occasion, I provided a customer a refund when company policy states that I am not supposed to be providing refunds under any circumstance.","It was all my fault. I was having a stressful day already and provided the customer with bad information unintentionally. However, because of my mistake, the customer purchased a product which they did not need. I knew it was my fault. They knew it was my fault. I could not deny them a refund when I knew it was the right thing to do.",I received a verbal warning over breaking company policy and the refund I issued was docked from my pay. ,My manager was definitely not happy. I was scolded for not paying attention and for breaking company refund policy. I was warned to never allow this situation to occur again.,-2,-2,1,-1,Retail sales,I worked retail sales for a technology manufacturer. I was a front-line employee working directly with customers.,0,"No, everything made sense.",
194,7/13/21 13:25,R_TbiKOqrwvCPMvlL,I don't always write up students when it's mandatory to do so.,Because sometimes the procedures that occur will cause them harm in a way that is not helpful or productive.,"Typically there haven't been because without writing them up, it's not known about on a higher level. ","They haven't responded, presumably because they aren't aware.",0,0,2,-1,Teacher working in a school,"The typical responsibilities of teachers, planning lessons, teaching lessons, working with kids and giving them feedback.",0,No.,
486,7/13/21 13:27,R_D2HKA1xDRseb2nf,"The only time I can think of is when I was younger working in a Seneca Juice plant as a press operator.  We had to clean the presses every day using acids and caustics.   We were required to wear PPE while we were handling the chemicals.  Since it was graveyard shift and it was exceptionally hot, I had a habit of not wearing the required equipment.",It was always around 80 or 90 degrees because of the steam lines running through the plant.  Wearing the safety equipment just made it worse so unless management of safety officers were running around.   I just went ahead without the rubber suit.,none.  It was really a generally accepted practice even though it went against stated company protocols.,He never said a word.   Either he wasn't really aware of it or he chose not to make an issue of it.,1,1,-1,0,Machine operator in a juice processing plant.,Run machines that pressed fruit to obtain juice for processing.,0,"nope, it seemed just fine to me.",
273,7/13/21 13:28,R_Zlv4mQ3DuZlHfR7,I came in late without letting anyone know that I would be late.,My dog was in status epilepticus. ,There were none.,She felt bad for me.  She was sympathetic.,-1,-2,2,0,university library,I was a circ desk supervisor.,1,no,
284,7/13/21 13:42,R_2tGs3XUmOt0iC7t,I decided not to complete an assignment that was given to me.,"I didn't do it because I had so much on my plate from my own work, and another department had asked me to complete something that was under no way part of my job responsibilities. They tasked me with the work because it had the slightest technical aspect to it and they were too lazy to learn the slightest bit of technical concept on their own. I just had way too much to complete and I decided I wasn't going to complete the other assignment, especially when there were others already working on it and it really wasn't necessary for me to add anything to it. ",There were no consequences.,They did not say anything.,1,0,0,2,Technology,"Fixing bugs, writing code and improving the product.",0,No,
176,7/13/21 13:46,R_3m3JRNbY60PBSNL,I worked overnight and took several unscheduled breaks when no one was around.,Nobody would know and my job didn't pay enough or respect me as an employee enough to make me care much about anything.,Nothing,Never knew,2,-2,-2,-2,Information,I organized medical documents into appropriate categories.,0,no,no
461,7/13/21 13:55,R_2YGkb5PxtrJ7nWB,"We have a policy that a person must clock in within five minutes of his scheduled shift start time. I was feeling lazy and purposefully didn't get ready for work in time, and I showed up to work thirty minutes after my scheduled shift start time.",I just didn't feel like rushing to get ready for work. I didn't feel like working at all that day.,"My manager gave me a dirty look and told me that she had to wait an extra thirty minutes past her scheduled end-of-shift before she could leave because she had to wait for me to pass off the shift to me because I was shift supervisor that evening. She said she really didn't appreciate my lateness, and that if it happened again she would tell the owner of the business we worked for.","As I explained above, she was angry at me and threatened to tell the owner of the business if it ever happened again.",2,-2,-2,-2,I worked at a business casual wine bar and eatery.,I was a shift supervisor. I had the responsibility of making sure all the food servers were doing their jobs properly by giving all our guests excellent service.,1,no,no
238,7/13/21 13:59,R_1ImV2z8mEYRICJA,I intentionally showed up for work thirty minutes past my scheduled shift start time.,I was feeling lazy. I didn't feel like rushing to get ready for work. I wanted to take my time getting ready for work. I honestly didn't feel like going to work at all that day.,I was reprimanded.,"My manager said that if I ever showed up to late work again, she would tell the owner of the restaurant and try to make sure I got in trouble.",2,-2,-2,-2,I was working at an upscale wine bar and eatery.,I was a shift supervisor. I was responsible for making sure all the servers on my shift were doing their jobs properly by giving all our guests excellent customer service.,1,no,no
203,7/13/21 14:10,R_1ouI6KjTXEaMEvc,I took an extra day off that I didn't have in my schedule or was allowed to take per the company rules.,I was on a vacation with my family and the travel schedule did not permit me to get home any earlier than the date I had inform them of. ,I was docked a day's pay. ,Although he completely understood he advised me to try to not do it again in the future. ,-2,-2,2,2,I was the marketing director for a manufacturing company. ,"Budget planning, personnel, development of sales materials, interaction with sales work with advertising companies plan the budget for the next five years. ",1,No it was not ,That's alright thank you 
342,7/13/21 14:12,R_2tlFOrigGcKXw91,One time I used my cellphone during work hours even though we were not allowed to do that. ,I did that because I kept getting ding repeatedly on my phone so that is why I checked it real quick just to make sure it wasn't an emergency at home or something. ,There were no consequences because I was not caught in the act. ,I was not caught in the act but if I were caught in the act I think my manager would understand the situation and not punish me. ,-1,-2,0,1,retail manufacturing,Picking customer's orders from different areas of the warehouse. If I'm not picking then I'm restocking products from recent shipments. ,0,no,
253,7/13/21 14:23,R_10IcDL2V0IMY0yF,The deadline was approaching and I knew I wouldn't have any time to finish it so I made the report without knowing all of the facts. I had an idea of how it would look but I didn't know exactly what the report would say.,Management didn't give me enough time to finish it,There weren't any consequences because the report was close enough,He understood that I didn't really have a choice.,0,2,0,2,accounting,I monitored spending budgets and prepared reports.,0,no,
381,7/13/21 14:27,R_2doMAtzehamIhew,My point of view The key to successfully answering this question is to prove why it was necessary. I would suggest the best type of example for this question is a clear customer service incident – A time where you have gone above and beyond to help and delight a customer – But had to break a rule in the process.,"I think Rule breaking is driven by personal attitude, the environment employees operate in, and external pressure, which cause employees to make decisions at the spur of the moment to either follow or break the rule. The same rule can be broken for different reasons at different times.","I think Be appreciative for the lesson. ""One time, I disagreed with my manager over the best way to help a customer.","My point of view, Build a strong culture. 
Recognise and reward your employees. 
Create an good office environment. 
Encourage a work:life balance.
Active, transparent and empathetic leadership.",-1,1,1,1,Finance,I think fully truth work.,1,None,None
249,7/13/21 14:28,R_32JwbNYqCf6Ip7X,I took a sick day in order to do a personal task.,I did so because I needed some extra time off work to take care of personal matters.,There were no consequences. ,My manager never found out about what I did. ,2,-1,1,0,business,I was responsible for various data analysis tasks. ,0,no,
228,7/13/21 15:01,R_1rqpASxmYdIhofS,I brought home a couple of sodas from the break room fridge.,"I was out of soda at home, and didn't want to go to the store halfway through the week.",I was told not to do that anymore. I didn't and avoided any more punishment.,"Disapprovingly, but she wasn't overly mad at me. ",2,-2,-2,-1,Legal services,Running documents to other firms and the courts. I also kept up with our physical files and helped attorneys with putting together physical materials for court.,0,No,
593,7/13/21 15:17,R_1rB0eD7J3EHmE0x,While making deliveries for a well known pizza franchise I would often stop at a fast food drive in on the way back from a run to usually get something mexican like tacos and eat in the car during the next run.,"Hungry and not wanting to eat what they had which were usually ""crew pies"" (burned or returned pizzas) for the workers.",Worse that would happen is a verbal reprimand but I never got caught.,He would not like it. He would probably tell me I could not be doing that but no real consequences i don't think. The longer I worked there the more comfortable I got breaking rules.,2,-1,2,0,Dominos Pizza delivery driver,Deliver multiple pizzas to homes during one trip on time if possible. The main responsibility was my safety when driving. The other was taking orders correctly as any error would cause a return. ,0,no,
119,7/13/21 15:56,R_2xXFbZ5AJwmwLy6,"I did personal tasks during my work hours, even though I knew it was something my employer frowned upon.",I didn't have any work to do and I was bored. I figured I would at least be productive for myself.,There weren't any. No one found out.,My manager had no response because he didn't know about it.,2,-2,-2,1,manufacturing,"I was an office assistant at a manufacturing facility, so I mostly printed and organized paperwork.",0,No,
161,7/13/21 16:28,R_3G9Q7v0MGI1RtZt,I took more than a 10 minute break because I wanted to finish my cigarette and I took an extra 5 minutes off.,I wanted to finish my cigaratte.,Nothing,She may have looked at me wondering why I was 5 minutes late.,-1,-2,-1,-1,I was working for a electronic component company.,I was a QA Inspector and assembler for a gold components company that built components for self-defense companies.,1,No,No
131,7/13/21 16:48,R_3Ed45RMz6o8ItTr,I have called out without the proper amount of time to inform work.,My best friend died.,They were accepting,THey werent happy but accepted it.,2,-2,2,1,Fast Food,I worked on a grill and was responsible for ensuring that food was on the line. I also cleaned.,0,,
193,7/13/21 16:58,R_1d0phoGJ6cz0O45,I took a longer break than I was supposed to ,I was feeling grumpy and a bit rebellious and didn't care about going back to work on time.,There were no consequences,They let it slide since I am hardly a rule breaker at work. ,1,-1,-1,0,Retail,"Unloading trucks, taking inventory, setting displays for new products",0,No,Thanks!!
257,7/13/21 16:58,R_etIsfC92QhSl4nT,"I have a pretty abnormal sleep schedule (DSPS) so I am super productive at night but need to sleep into the day.  Since I am working from home now and do not have a lot of meetings scheduled, I've turned off my alarm and just wake up when my body is ready.",To get really good sleep.,Sometimes it takes a while to respond to AM emails so people might be able to tell that I'm not working yet.,"He hasn't noticed, but if I discussed it with him I think he'd be OK with it.",2,1,-1,1,Information,I put together oil and gas data sets for clients.,0,No.,
156,7/13/21 17:03,R_3exBaz6espRIF61,I spent extra hours staying at work and completing a project. ,I was on a role and I didn't want to stop while I felt like I was going strong. ,I didn't get paid for the extra time. ,"He was happy that I was passionate about the project, but said that I should have done it during normal working hours. ",0,2,1,0,Web Development. ,Making websites for small businesses and other people. ,0,No. ,
253,7/13/21 17:19,R_eeys2oVIcrxsCNH,I started working before my shift started.  ,"Because I always arrived early, and didn't like just wasting time.",I got a good start on the days work.,I got talked to about it.,1,1,1,0,Insurance ,"Respond to agent inquiries about their bonuses, did data analysis, did quality control, etc.",0,No,
