duration,date,subjectcode,rule.break,why,consequences,manager.response,consq.different,you,company,other,agree,industry,job.description,manager,comments1,comments2
312,5/26/21 23:52,R_23UGpT5Qjj0lnYU,"One time, when I first started a job at McDonalds, I was working my second or third day on the job, and at the end of the day I was putting the leftover food away, to take some for myself.","Well, on the first few nights I worked there, all the employees gathered up what they wanted, and just kept it. So I thought it was something that was normal to be done. I didn't realize that it was normal to be done only if CERTAIN managers were working that night, and not normal if OTHERS were not.","I was told that I was not to do that. I didn't get into any trouble for it, as I was new at the time.","My manager told me not to do that, and explained that it isn't what is to be done.","Yes, I didn't expect that there would be any consequences at all. No one had told me not to do it that night, as we had been doing it the nights before when we finished working. So I was pretty surprised when I found out we were supposed to throw all the unused food away.",2,2,2,-1,Food service industry,"Fry cook; cooked patties, nuggets, chickens of all sorts, made burgers, sandwiches, salads, cookies, pies, cleaned dishes, cleaned floors, took trash, and so on.",0,"No, everything was clear.","I just want to clarify about my previous answers. Some managers did benefit from breaking the rules, because they got to keep the food, too. Others obviously didn't, when they didn't break the rules."
406,5/27/21 0:18,R_3NQJU6tbvYTyPBr,You are best to answer these questions yourself and honestly. The reason is they ask the SAME questions,nothing,nothing,nothing,nothing,1,1,1,1,techonogy,"Your responsibilities as an employee are the key duties, tasks and functions that make up your specific role within a company. Examples of responsibilities could include supervising staff, negotiating contracts or pitching to clients.",1,nothing,
546,5/27/21 1:59,R_24LWgmdf2Rw7b1N,"It is our company rule that we should not use company products for personal use, but I had used office printer and internet for personal use","Because the printer that I have in my home is out of ink and I thought that I can use the office printer, so that I can save the money for refilling the ink in my printer. I use company wifi for personal use so that I need not spent money for my internet usage.",I felt embarrassed or bad when someone notices it or finds it out. I will be given warning for not doing it in future.,He would warn me and ask for my written apology to the company,no,2,-2,1,-1,Information Technology,I am the team leader and so I have 8 subordinates under my supervision. I will be guiding and directing them along with my coding and decoding programs,1,no,no
2529,5/27/21 2:10,R_3EDPmI7iGnjrqEL,So when I use to work parties and served people food and took care of them I had one guest who was vegetarian. The thing is usually we know this ahead of time. They did get the memo. But we had this rule where we aren't supposed to go in the back and ask the chefs ourselves. We are to find a higher up to do it for us. Thing is no higher ups where near me so I ran and did it myself to make sure they got their food the same time as everyone else.,I didn't want them to be left out for a while they made that person their dish. ,Nothing really. They were mad for a bit.,The higher ups were upset but came to their senses when I explained why I did it. They understood where I was coming from.,No they weren't. I had a good reason for doing what I did. I figured they would understand. I really didn't see it going beyond that.,-2,-2,-2,1,Hospitality ,We were to serve food to the customers. We were also supposed to take care of any other requests they had.,0,No.,
274,5/27/21 2:17,R_3hfIb2WBGUoHCzC,the company rule is not to have romantic relationship with coworkers. I fell love with a colleague and asked her out on a date,because I couldn't help myself from doing it,I was fired,"he talked to me, advised me to discontinue the relationship",no,2,-2,1,-1,Accounting firm as an accountant,preparation of Financial statements ,0,no,
1249,5/27/21 2:29,R_1ITroTHG6GBFLvJ,"There was a construction going on at my company which caused lots of hassles and stress made me sick, I did complain severally but no one listened, so I took 2days off to tend to my health.",My health was deteriorating,I was transferred to a farther branch for 2weeks,My manager made me work from another branch which was really far from my house,"Yes, I thought the management would understand my plight and let it slide",1,0,0,0,Telesales/transportation and vehicle sales I,I responded to calls of potential customers and walked them through the different packages we offer and tried to convince as many as I could to make deposit,0,None,none 
2450,5/27/21 2:54,R_0V4egYjTD0sNR4J,I found a wallet on the property and called him and left a message when he could pick it up.  Policy is to give it to the front desk.,"Frankly, I didn't trust the lady at the front desk; when I told her that I found it, the first thing she asked was how much money was in it.  I also knew the person that lost it.","When the assistant manager was condescending and wouldn't listen to me, I quit about 15 mins. later!","As I said, she acted inappropriately.  I have a good deal of management experience and what she did was way out of line.  You listen to your employee before you reprimand them; I am an ideal employee and was an employee of the year at a large prestigious hotel doing the same type of work.  They did deserve my expertise. ","Lol, much different. ",1,0,1,0,Hospitality ,"The night maintenance engineer, from plunging toilets to making management decisions after the management left for the evening. 

To clarify the answer below, I did but not with a title or financial recognition.",1,no,They sold the hotel not to long after I left :)
22840,5/27/21 3:13,R_es1f8ooSoj9PeaR,"There was one occassion where my boss did not seem to offer me the correct or safe intervention.  He was new, and I did not trust his advice.  This is usually considered insubordination.  But I actually went  to the person who is in charge of that department and got their advice to contradict my bosses.","I was concerned about  my job.  Just because you are not the first in the chain of command to receive backlash for doing something incorrectly, does not means that it won't still happen.","It ended up causing controversy.  My boss did not agree with my opinion and was frustrated over the issue.  The safety concern I feared, did in fact happen.  But I was able to mitigate for myself because I was expecting it, but that was not true for another employee.  Anyhow, I ended up being verbally reprimanded and no attention was given to the other employee outside of our department that was harmed.",Verbally reprimanded me.  I also heard a similar complaint for another boss further up the chain of command.,"Yes, but mostly because I and the other employee where able to keep the situation from becoming more problematic that it already was. But the problem still happened.",-2,0,0,-2,hospital,Most of the work involves patient care.  But there is also a significant amount of documentation and paperwork we do.,0,"A3POD149IG0DIW, no",no
251,5/27/21 3:30,R_4GyF8m8D8h213kl,When I was in the military I intentionally whent home after all the work was done even though I wasnt released.,I did it because I thought the norm to just sit around all day and wait was a problem. You should be able to try and progress yourself if you have the time and spend more time with your family.,The consequence was that I was called back into the office and yelled at for not being where I was supposed to be.,He yelled at me and told me that next time it happens it will be severe punishment and not just physical like this time.,"Yes, i thought they would demote me",1,-2,1,-1,Government/public,My job was to monitor radio and cell phone traffic of suspected enemies of the US,0,no,no
9151,5/27/21 4:00,R_ripk2fyq6mWPMwF,"When I  took some equipment from my organization , they were excess and they  were not being used well by other people.",they were excess and not functional ,no one noticed that,I apologized later and he said it was okay with him,no,2,-2,2,-2,manufacturing industry ,I  was the manager in charge in my department and we had so many weighing machines ,1,no,
220,5/27/21 4:53,R_3kuDpso2RaYxZdP,I would often not punch out for lunch and would eat in the office while I continued to work.  It was against policy and we were supposed to punch out for lunch.,I did not have any coverage as a manager. I was the only manager in the store and could not leave to have lunch and not have the store unattended.,I could be fired for leaving the store and the employees without a manager.,I was told to punch out and stay.  I was told that I should basically work without getting paid for it.,"Yes, I was always expecting that I would be paid when I was at work and doing work.  ",0,-1,-2,-2,retail management,I was a department manager at a retail store.  I was second to the highest in the chain in command.,1,no,no
893,5/27/21 8:53,R_28YaxHHw0bN3Pct,I did not submit activity reports daily instead writing them all on Thursday and Friday.,This saved me time in the productivity department.,A write up if it brought up and not changed,My manager did not notice.,I didnt find out.. I like to ask for forgiveness instead of permisson,2,1,1,0,Law-Firm quality backgrounds.,I worked as an independent background investigator on cases. I also reviewed internal backgrounds.,0,No,Working indecently but on the payroll. I indirectly managed employees.